[
  {
    "date": "2026-01-01",
    "sessions": [],
    "daily_reading_min": 0,
    "topics": []
  },
  {
    "date": "2026-01-02",
    "sessions": [
      {
        "title": "Procreate高级技巧分享",
        "category": "设计",
        "duration_min": 24,
        "highlights": 1,
        "time_range": "12:10-12:34"
      },
      {
        "title": "如何建立个人品牌",
        "category": "营销",
        "duration_min": 20,
        "highlights": 2,
        "time_range": "13:13-13:33"
      },
      {
        "title": "插画师如何找到稳定客户",
        "category": "职业",
        "duration_min": 17,
        "highlights": 0,
        "time_range": "16:34-16:51"
      }
    ],
    "daily_reading_min": 61,
    "topics": [
      "设计",
      "营销",
      "职业"
    ]
  },
  {
    "date": "2026-01-03",
    "sessions": [],
    "daily_reading_min": 0,
    "topics": []
  },
  {
    "date": "2026-01-04",
    "sessions": [
      {
        "title": "插画师如何找到稳定客户",
        "category": "职业",
        "duration_min": 12,
        "highlights": 3,
        "time_range": "20:04-20:16"
      },
      {
        "title": "色彩理论与实际应用",
        "category": "艺术",
        "duration_min": 15,
        "highlights": 4,
        "time_range": "17:10-17:25"
      }
    ],
    "daily_reading_min": 27,
    "topics": [
      "职业",
      "艺术"
    ]
  },
  {
    "date": "2026-01-05",
    "sessions": [],
    "daily_reading_min": 0,
    "topics": []
  },
  {
    "date": "2026-01-06",
    "sessions": [],
    "daily_reading_min": 0,
    "topics": []
  },
  {
    "date": "2026-01-07",
    "sessions": [
      {
        "title": "如何建立个人品牌",
        "category": "营销",
        "duration_min": 25,
        "highlights": 0,
        "time_range": "17:21-17:46"
      },
      {
        "title": "灵感枯竭怎么办",
        "category": "创意",
        "duration_min": 40,
        "highlights": 2,
        "time_range": "14:25-15:05"
      },
      {
        "title": "独居生活省钱攻略",
        "category": "生活",
        "duration_min": 44,
        "highlights": 3,
        "time_range": "17:02-17:46"
      }
    ],
    "daily_reading_min": 109,
    "topics": [
      "营销",
      "创意",
      "生活"
    ]
  },
  {
    "date": "2026-01-08",
    "sessions": [
      {
        "title": "如何建立个人品牌",
        "category": "营销",
        "duration_min": 31,
        "highlights": 2,
        "time_range": "11:19-11:50"
      },
      {
        "title": "如何度过自由职业的低谷期",
        "category": "自我成长",
        "duration_min": 13,
        "highlights": 0,
        "time_range": "15:48-16:01"
      }
    ],
    "daily_reading_min": 44,
    "topics": [
      "营销",
      "自我成长"
    ]
  },
  {
    "date": "2026-01-09",
    "sessions": [],
    "daily_reading_min": 0,
    "topics": []
  },
  {
    "date": "2026-01-10",
    "sessions": [
      {
        "title": "如何在社交媒体推广作品",
        "category": "营销",
        "duration_min": 13,
        "highlights": 2,
        "time_range": "17:33-17:46"
      }
    ],
    "daily_reading_min": 13,
    "topics": [
      "营销"
    ]
  },
  {
    "date": "2026-01-11",
    "sessions": [
      {
        "title": "色彩理论与实际应用",
        "category": "艺术",
        "duration_min": 11,
        "highlights": 1,
        "time_range": "19:31-19:42"
      },
      {
        "title": "色彩理论与实际应用",
        "category": "艺术",
        "duration_min": 10,
        "highlights": 3,
        "time_range": "12:05-12:15"
      }
    ],
    "daily_reading_min": 21,
    "topics": [
      "艺术"
    ]
  },
  {
    "date": "2026-01-12",
    "sessions": [
      {
        "title": "Procreate高级技巧分享",
        "category": "设计",
        "duration_min": 12,
        "highlights": 4,
        "time_range": "22:08-22:20"
      }
    ],
    "daily_reading_min": 12,
    "topics": [
      "设计"
    ]
  },
  {
    "date": "2026-01-13",
    "sessions": [
      {
        "title": "灵感枯竭怎么办",
        "category": "创意",
        "duration_min": 12,
        "highlights": 4,
        "time_range": "13:26-13:38"
      }
    ],
    "daily_reading_min": 12,
    "topics": [
      "创意"
    ]
  },
  {
    "date": "2026-01-14",
    "sessions": [
      {
        "title": "如何建立个人品牌",
        "category": "营销",
        "duration_min": 30,
        "highlights": 0,
        "time_range": "17:03-17:33"
      },
      {
        "title": "日本插画风格解析",
        "category": "艺术",
        "duration_min": 26,
        "highlights": 3,
        "time_range": "14:14-14:40"
      }
    ],
    "daily_reading_min": 56,
    "topics": [
      "营销",
      "艺术"
    ]
  },
  {
    "date": "2026-01-15",
    "sessions": [],
    "daily_reading_min": 0,
    "topics": []
  },
  {
    "date": "2026-01-16",
    "sessions": [
      {
        "title": "自由职业者理财指南",
        "category": "理财",
        "duration_min": 41,
        "highlights": 3,
        "time_range": "20:24-21:05"
      },
      {
        "title": "插画师如何找到稳定客户",
        "category": "职业",
        "duration_min": 21,
        "highlights": 4,
        "time_range": "17:32-17:53"
      },
      {
        "title": "日本插画风格解析",
        "category": "艺术",
        "duration_min": 36,
        "highlights": 2,
        "time_range": "18:20-18:56"
      }
    ],
    "daily_reading_min": 98,
    "topics": [
      "理财",
      "职业",
      "艺术"
    ]
  },
  {
    "date": "2026-01-17",
    "sessions": [
      {
        "title": "如何度过自由职业的低谷期",
        "category": "自我成长",
        "duration_min": 26,
        "highlights": 4,
        "time_range": "21:09-21:35"
      },
      {
        "title": "插画师如何找到稳定客户",
        "category": "职业",
        "duration_min": 38,
        "highlights": 1,
        "time_range": "16:23-17:01"
      }
    ],
    "daily_reading_min": 64,
    "topics": [
      "自我成长",
      "职业"
    ]
  },
  {
    "date": "2026-01-18",
    "sessions": [
      {
        "title": "色彩理论与实际应用",
        "category": "艺术",
        "duration_min": 43,
        "highlights": 0,
        "time_range": "22:39-23:22"
      }
    ],
    "daily_reading_min": 43,
    "topics": [
      "艺术"
    ]
  },
  {
    "date": "2026-01-19",
    "sessions": [
      {
        "title": "水彩技法入门到进阶",
        "category": "艺术",
        "duration_min": 12,
        "highlights": 3,
        "time_range": "20:03-20:15"
      },
      {
        "title": "日本插画风格解析",
        "category": "艺术",
        "duration_min": 44,
        "highlights": 2,
        "time_range": "14:07-14:51"
      },
      {
        "title": "Procreate高级技巧分享",
        "category": "设计",
        "duration_min": 29,
        "highlights": 1,
        "time_range": "20:36-21:05"
      }
    ],
    "daily_reading_min": 85,
    "topics": [
      "艺术",
      "设计"
    ]
  },
  {
    "date": "2026-01-20",
    "sessions": [],
    "daily_reading_min": 0,
    "topics": []
  },
  {
    "date": "2026-01-21",
    "sessions": [
      {
        "title": "如何在社交媒体推广作品",
        "category": "营销",
        "duration_min": 28,
        "highlights": 4,
        "time_range": "10:22-10:50"
      },
      {
        "title": "独居生活省钱攻略",
        "category": "生活",
        "duration_min": 19,
        "highlights": 0,
        "time_range": "21:45-22:04"
      },
      {
        "title": "灵感枯竭怎么办",
        "category": "创意",
        "duration_min": 18,
        "highlights": 4,
        "time_range": "14:46-15:04"
      }
    ],
    "daily_reading_min": 65,
    "topics": [
      "营销",
      "生活",
      "创意"
    ]
  },
  {
    "date": "2026-01-22",
    "sessions": [],
    "daily_reading_min": 0,
    "topics": []
  },
  {
    "date": "2026-01-23",
    "sessions": [
      {
        "title": "如何度过自由职业的低谷期",
        "category": "自我成长",
        "duration_min": 14,
        "highlights": 3,
        "time_range": "23:26-23:40"
      },
      {
        "title": "小说：三体（重读）",
        "category": "小说",
        "duration_min": 42,
        "highlights": 4,
        "time_range": "23:46-23:59"
      }
    ],
    "daily_reading_min": 56,
    "topics": [
      "自我成长",
      "小说"
    ]
  },
  {
    "date": "2026-01-24",
    "sessions": [
      {
        "title": "色彩理论与实际应用",
        "category": "艺术",
        "duration_min": 12,
        "highlights": 3,
        "time_range": "23:30-23:42"
      },
      {
        "title": "独居生活省钱攻略",
        "category": "生活",
        "duration_min": 21,
        "highlights": 0,
        "time_range": "21:41-22:02"
      }
    ],
    "daily_reading_min": 33,
    "topics": [
      "艺术",
      "生活"
    ]
  },
  {
    "date": "2026-01-25",
    "sessions": [
      {
        "title": "插画师如何找到稳定客户",
        "category": "职业",
        "duration_min": 42,
        "highlights": 4,
        "time_range": "10:32-11:14"
      },
      {
        "title": "如何建立个人品牌",
        "category": "营销",
        "duration_min": 17,
        "highlights": 2,
        "time_range": "12:18-12:35"
      }
    ],
    "daily_reading_min": 59,
    "topics": [
      "职业",
      "营销"
    ]
  },
  {
    "date": "2026-01-26",
    "sessions": [
      {
        "title": "色彩理论与实际应用",
        "category": "艺术",
        "duration_min": 38,
        "highlights": 0,
        "time_range": "15:34-16:12"
      },
      {
        "title": "如何建立个人品牌",
        "category": "营销",
        "duration_min": 14,
        "highlights": 0,
        "time_range": "15:11-15:25"
      }
    ],
    "daily_reading_min": 52,
    "topics": [
      "艺术",
      "营销"
    ]
  },
  {
    "date": "2026-01-27",
    "sessions": [
      {
        "title": "插画师如何找到稳定客户",
        "category": "职业",
        "duration_min": 43,
        "highlights": 2,
        "time_range": "20:40-21:23"
      }
    ],
    "daily_reading_min": 43,
    "topics": [
      "职业"
    ]
  },
  {
    "date": "2026-01-28",
    "sessions": [
      {
        "title": "如何建立个人品牌",
        "category": "营销",
        "duration_min": 14,
        "highlights": 3,
        "time_range": "21:38-21:52"
      }
    ],
    "daily_reading_min": 14,
    "topics": [
      "营销"
    ]
  },
  {
    "date": "2026-01-29",
    "sessions": [
      {
        "title": "如何度过自由职业的低谷期",
        "category": "自我成长",
        "duration_min": 36,
        "highlights": 2,
        "time_range": "18:10-18:46"
      }